Sheet: 500ms
B1: Column A | C1: Column C
A2: 1 | B2: NaN | C2: NaN
A3: 2 | B3: NaN | C3: NaN
A4: 3 | B4: NaN | C4: NaN
A5: 4 | B5: NaN | C5: NaN
A6: 5 | B6: 255 | C6: 8630
A7: 6 | B7: 0 | C7: 8314.63
A8: 7 | B8: 255 | C8: 8650
A9: 8 | B9: 0 | C9: 8297.41
A10: 9 | B10: 255 | C10: 8650
A11: 10 | B11: 0 | C11: 8307.39
A12: 11 | B12: 255 | C12: 8650
A13: 12 | B13: 0 | C13: 8311.38
A14: 13 | B14: 255 | C14: 8650
A15: 14 | B15: 0 | C15: 8315.37
A16: 15 | B16: 255 | C16: 8574.26
A17: 16 | B17: 0 | C17: 8332
A18: 17 | B18: 255 | C18: 8574.26
A19: 18 | B19: 0 | C19: 8332
A20: 19 | B20: 255 | C20: 8747.47
A21: 20 | B21: 0 | C21: 8315.37
A22: 21 | B22: 255 | C22: 8660
A23: 22 | B23: 0 | C23: 8315.37
A24: 23 | B24: 255 | C24: 8660
A25: 24 | B25: 0 | C25: 8315.37
A26: 25 | B26: 255 | C26: 8660
A27: 26 | B27: 0 | C27: 8317.37
A28: 27 | B28: 255 | C28: 8574.26
A29: 28 | B29: 0 | C29: 8334
A30: 29 | B30: 255 | C30: 8574.26
A31: 30 | B31: 0 | C31: 8332
A32: 31 | B32: 255 | C32: 8660
A33: 32 | B33: 0 | C33: 8313.37
A34: 33 | B34: 255 | C34: 8737.37
A35: 34 | B35: 0 | C35: 8311.38
A36: 35 | B36: 255 | C36: 8650
A37: 36 | B37: 0 | C37: 8307.39
A38: 37 | B38: 255 | C38: 8650
A39: 38 | B39: 0 | C39: 8307.39
A40: 39 | B40: 255 | C40: 8564.36
A41: 40 | B41: 0 | C41: 8328
B42: Column A | C42: Column B
A43: 1 | B43: 255 | C43: 330
A44: 2 | B44: 0 | C44: 14.6299999999992
A45: 3 | B45: 255 | C45: 350
A46: 4 | B46: 0 | C46: -2.59000000000015
A47: 5 | B47: 255 | C47: 350
A48: 6 | B48: 0 | C48: 7.38999999999942
A49: 7 | B49: 255 | C49: 350
A50: 8 | B50: 0 | C50: 11.3799999999992
A51: 9 | B51: 255 | C51: 350
A52: 10 | B52: 0 | C52: 15.3700000000008
A53: 11 | B53: 255 | C53: 274.26
A54: 12 | B54: 0 | C54: 32
A55: 13 | B55: 255 | C55: 274.26
A56: 14 | B56: 0 | C56: 32
A57: 15 | B57: 255 | C57: 447.469999999999
A58: 16 | B58: 0 | C58: 15.3700000000008
A59: 17 | B59: 255 | C59: 360
A60: 18 | B60: 0 | C60: 15.3700000000008
A61: 19 | B61: 255 | C61: 360
A62: 20 | B62: 0 | C62: 15.3700000000008
A63: 21 | B63: 255 | C63: 360
A64: 22 | B64: 0 | C64: 17.3700000000008
A65: 23 | B65: 255 | C65: 274.26
A66: 24 | B66: 0 | C66: 34
A67: 25 | B67: 255 | C67: 274.26
A68: 26 | B68: 0 | C68: 32
A69: 27 | B69: 255 | C69: 360
A70: 28 | B70: 0 | C70: 13.3700000000008
A71: 29 | B71: 255 | C71: 437.370000000001
A72: 30 | B72: 0 | C72: 11.3799999999992
A73: 31 | B73: 255 | C73: 350
A74: 32 | B74: 0 | C74: 7.38999999999942
A75: 33 | B75: 255 | C75: 350
A76: 34 | B76: 0 | C76: 7.38999999999942
A77: 35 | B77: 255 | C77: 264.360000000001
A78: 36 | B78: 0 | C78: 28
E79: 255 | F79: of:=SUM([.G1]; -8000) -> 330 | G79: 8330
E80: 0 | F80: of:=SUM([.G2]; -8000) -> 27.9399999999996 | G80: 8027.94
E81: 255 | F81: of:=SUM([.G3]; -8000) -> 475.25 | G81: 8475.25
E82: 0 | F82: of:=SUM([.G4]; -8000) -> 244 | G82: 8244
A83: 255 | B83: of:=SUM([.C5]; -8300) -> 330 | C83: 8630
A84: 0 | B84: of:=SUM([.C6]; -8300) -> 14.6299999999992 | C84: 8314.63
A85: 255 | B85: of:=SUM([.C7]; -8300) -> 350 | C85: 8650
A86: 0 | B86: of:=SUM([.C8]; -8300) -> -2.59000000000015 | C86: 8297.41
A87: 255 | B87: of:=SUM([.C9]; -8300) -> 350 | C87: 8650
A88: 0 | B88: of:=SUM([.C10]; -8300) -> 7.38999999999942 | C88: 8307.39
A89: 255 | B89: of:=SUM([.C11]; -8300) -> 350 | C89: 8650
A90: 0 | B90: of:=SUM([.C12]; -8300) -> 11.3799999999992 | C90: 8311.38
A91: 255 | B91: of:=SUM([.C13]; -8300) -> 350 | C91: 8650
A92: 0 | B92: of:=SUM([.C14]; -8300) -> 15.3700000000008 | C92: 8315.37
A93: 255 | B93: of:=SUM([.C15]; -8300) -> 274.26 | C93: 8574.26
A94: 0 | B94: of:=SUM([.C16]; -8300) -> 32 | C94: 8332
A95: 255 | B95: of:=SUM([.C17]; -8300) -> 274.26 | C95: 8574.26
A96: 0 | B96: of:=SUM([.C18]; -8300) -> 32 | C96: 8332
A97: 255 | B97: of:=SUM([.C19]; -8300) -> 447.469999999999 | C97: 8747.47
A98: 0 | B98: of:=SUM([.C20]; -8300) -> 15.3700000000008 | C98: 8315.37
A99: 255 | B99: of:=SUM([.C21]; -8300) -> 360 | C99: 8660
A100: 0 | B100: of:=SUM([.C22]; -8300) -> 15.3700000000008 | C100: 8315.37
A101: 255 | B101: of:=SUM([.C23]; -8300) -> 360 | C101: 8660
A102: 0 | B102: of:=SUM([.C24]; -8300) -> 15.3700000000008 | C102: 8315.37
A103: 255 | B103: of:=SUM([.C25]; -8300) -> 360 | C103: 8660
A104: 0 | B104: of:=SUM([.C26]; -8300) -> 17.3700000000008 | C104: 8317.37
A105: 255 | B105: of:=SUM([.C27]; -8300) -> 274.26 | C105: 8574.26
A106: 0 | B106: of:=SUM([.C28]; -8300) -> 34 | C106: 8334
A107: 255 | B107: of:=SUM([.C29]; -8300) -> 274.26 | C107: 8574.26
A108: 0 | B108: of:=SUM([.C30]; -8300) -> 32 | C108: 8332
A109: 255 | B109: of:=SUM([.C31]; -8300) -> 360 | C109: 8660
A110: 0 | B110: of:=SUM([.C32]; -8300) -> 13.3700000000008 | C110: 8313.37
A111: 255 | B111: of:=SUM([.C33]; -8300) -> 437.370000000001 | C111: 8737.37
A112: 0 | B112: of:=SUM([.C34]; -8300) -> 11.3799999999992 | C112: 8311.38
A113: 255 | B113: of:=SUM([.C35]; -8300) -> 350 | C113: 8650
A114: 0 | B114: of:=SUM([.C36]; -8300) -> 7.38999999999942 | C114: 8307.39
A115: 255 | B115: of:=SUM([.C37]; -8300) -> 350 | C115: 8650
A116: 0 | B116: of:=SUM([.C38]; -8300) -> 7.38999999999942 | C116: 8307.39
A117: 255 | B117: of:=SUM([.C39]; -8300) -> 264.360000000001 | C117: 8564.36
A118: 0 | B118: of:=SUM([.C40]; -8300) -> 28 | C118: 8328

Sheet: 250ms
B1: Column A | C1: Column B
A2: 1 | B2: 0 | C2: 14.7399999999998
A3: 2 | B3: 255 | C3: 346.459999999999
A4: 3 | B4: 0 | C4: 124
A5: 4 | B5: 255 | C5: 224.75
A6: 5 | B6: 0 | C6: 152
A7: 6 | B7: 255 | C7: 320
A8: 7 | B8: 0 | C8: 134.26
A9: 8 | B9: 255 | C9: 244.549999999999
A10: 9 | B10: 0 | C10: 138.25
A11: 10 | B11: 255 | C11: 330
A12: 11 | B12: 0 | C12: 146.209999999999
A13: 12 | B13: 255 | C13: 244.549999999999
A14: 13 | B14: 0 | C14: 180
A15: 14 | B15: 255 | C15: 427.27
A16: 15 | B16: 0 | C16: 146.209999999999
A17: 16 | B17: 255 | C17: 427.27
A18: 17 | B18: 0 | C18: 184
A19: 18 | B19: 255 | C19: 340
A20: 19 | B20: 0 | C20: 188
A21: 20 | B21: 255 | C21: 350
A22: 21 | B22: 0 | C22: 154.18
A23: 22 | B23: 255 | C23: 254.459999999999
A24: 23 | B24: 0 | C24: 158.17
A25: 24 | B25: 255 | C25: 350
A26: 25 | B26: 0 | C26: 158.17
A27: 26 | B27: 255 | C27: 254.459999999999
A28: 27 | B28: 0 | C28: 162.15
A29: 28 | B29: 255 | C29: 437.370000000001
A30: 29 | B30: 0 | C30: 166.129999999999
A31: 30 | B31: 255 | C31: 350
A32: 31 | B32: 0 | C32: 230.120000000001
A33: 32 | B33: 255 | C33: 350
A34: 33 | B34: 0 | C34: 166.129999999999
A35: 34 | B35: 255 | C35: 350
A36: 35 | B36: 0 | C36: 166.129999999999
A37: 36 | B37: 255 | C37: 350
A38: 37 | B38: 0 | C38: 166.129999999999
A39: 38 | B39: 255 | C39: 360
A40: 39 | B40: 0 | C40: 166.129999999999
A41: 40 | B41: 255 | C41: 274.26
A42: 41 | B42: 0 | C42: 166.129999999999
A43: 42 | B43: 255 | C43: 447.469999999999
A44: 0 | B44: of:=SUM([.C1]; -8300) -> 14.7399999999998 | C44: 8314.74
A45: 255 | B45: of:=SUM([.C2]; -8300) -> 346.459999999999 | C45: 8646.46
A46: 0 | B46: of:=SUM([.C3]; -8300) -> 124 | C46: 8424
A47: 255 | B47: of:=SUM([.C4]; -8300) -> 224.75 | C47: 8524.75
A48: 0 | B48: of:=SUM([.C5]; -8300) -> 152 | C48: 8452
A49: 255 | B49: of:=SUM([.C6]; -8300) -> 320 | C49: 8620
A50: 0 | B50: of:=SUM([.C7]; -8300) -> 134.26 | C50: 8434.26
A51: 255 | B51: of:=SUM([.C8]; -8300) -> 244.549999999999 | C51: 8544.55
A52: 0 | B52: of:=SUM([.C9]; -8300) -> 138.25 | C52: 8438.25
A53: 255 | B53: of:=SUM([.C10]; -8300) -> 330 | C53: 8630
A54: 0 | B54: of:=SUM([.C11]; -8300) -> 146.209999999999 | C54: 8446.21
A55: 255 | B55: of:=SUM([.C12]; -8300) -> 244.549999999999 | C55: 8544.55
A56: 0 | B56: of:=SUM([.C13]; -8300) -> 180 | C56: 8480
A57: 255 | B57: of:=SUM([.C14]; -8300) -> 427.27 | C57: 8727.27
A58: 0 | B58: of:=SUM([.C15]; -8300) -> 146.209999999999 | C58: 8446.21
A59: 255 | B59: of:=SUM([.C16]; -8300) -> 427.27 | C59: 8727.27
A60: 0 | B60: of:=SUM([.C17]; -8300) -> 184 | C60: 8484
A61: 255 | B61: of:=SUM([.C18]; -8300) -> 340 | C61: 8640
A62: 0 | B62: of:=SUM([.C19]; -8300) -> 188 | C62: 8488
A63: 255 | B63: of:=SUM([.C20]; -8300) -> 350 | C63: 8650
A64: 0 | B64: of:=SUM([.C21]; -8300) -> 154.18 | C64: 8454.18
A65: 255 | B65: of:=SUM([.C22]; -8300) -> 254.459999999999 | C65: 8554.46
A66: 0 | B66: of:=SUM([.C23]; -8300) -> 158.17 | C66: 8458.17
A67: 255 | B67: of:=SUM([.C24]; -8300) -> 350 | C67: 8650
A68: 0 | B68: of:=SUM([.C25]; -8300) -> 158.17 | C68: 8458.17
A69: 255 | B69: of:=SUM([.C26]; -8300) -> 254.459999999999 | C69: 8554.46
A70: 0 | B70: of:=SUM([.C27]; -8300) -> 162.15 | C70: 8462.15
A71: 255 | B71: of:=SUM([.C28]; -8300) -> 437.370000000001 | C71: 8737.37
A72: 0 | B72: of:=SUM([.C29]; -8300) -> 166.129999999999 | C72: 8466.13
A73: 255 | B73: of:=SUM([.C30]; -8300) -> 350 | C73: 8650
A74: 0 | B74: of:=SUM([.C31]; -8300) -> 230.120000000001 | C74: 8530.12
A75: 255 | B75: of:=SUM([.C32]; -8300) -> 350 | C75: 8650
A76: 0 | B76: of:=SUM([.C33]; -8300) -> 166.129999999999 | C76: 8466.13
A77: 255 | B77: of:=SUM([.C34]; -8300) -> 350 | C77: 8650
A78: 0 | B78: of:=SUM([.C35]; -8300) -> 166.129999999999 | C78: 8466.13
A79: 255 | B79: of:=SUM([.C36]; -8300) -> 350 | C79: 8650
A80: 0 | B80: of:=SUM([.C37]; -8300) -> 166.129999999999 | C80: 8466.13
A81: 255 | B81: of:=SUM([.C38]; -8300) -> 360 | C81: 8660
A82: 0 | B82: of:=SUM([.C39]; -8300) -> 166.129999999999 | C82: 8466.13
A83: 255 | B83: of:=SUM([.C40]; -8300) -> 274.26 | C83: 8574.26
A84: 0 | B84: of:=SUM([.C41]; -8300) -> 166.129999999999 | C84: 8466.13
A85: 255 | B85: of:=SUM([.C42]; -8300) -> 447.469999999999 | C85: 8747.47

Sheet: 100ms
B1: Column A | C1: Column B
A2: 1 | B2: 0 | C2: 180
A3: 2 | B3: 255 | C3: 260
A4: 3 | B4: 0 | C4: 250
A5: 4 | B5: 255 | C5: 310
A6: 5 | B6: 0 | C6: 204.950000000001
A7: 6 | B7: 255 | C7: 244.549999999999
A8: 7 | B8: 0 | C8: 224.75
A9: 8 | B9: 255 | C9: 447.469999999999
A10: 9 | B10: 0 | C10: 150.98
A11: 10 | B11: 255 | C11: 274.26
A12: 11 | B12: 0 | C12: 340
A13: 12 | B13: 255 | C13: 360
A14: 13 | B14: 0 | C14: 350
A15: 14 | B15: 255 | C15: 370
A16: 15 | B16: 0 | C16: 254.459999999999
A17: 16 | B17: 255 | C17: 370
A18: 17 | B18: 0 | C18: 350
A19: 18 | B19: 255 | C19: 380
A20: 19 | B20: 0 | C20: 180.389999999999
A21: 20 | B21: 255 | C21: 380
A22: 21 | B22: 0 | C22: 274.26
A23: 22 | B23: 255 | C23: 390
A24: 23 | B24: 0 | C24: 350
A25: 24 | B25: 255 | C25: 294.059999999999
A26: 25 | B26: 0 | C26: 360
A27: 26 | B27: 255 | C27: 390
A28: 27 | B28: 0 | C28: 350
A29: 28 | B29: 255 | C29: 380
A30: 29 | B30: 0 | C30: 274.26
A31: 30 | B31: 255 | C31: 303.959999999999
A32: 31 | B32: 0 | C32: 264.360000000001
A33: 32 | B33: 255 | C33: 477.780000000001
A34: 33 | B34: 0 | C34: 274.26
A35: 34 | B35: 255 | C35: 294.059999999999
A36: 35 | B36: 0 | C36: 360
A37: 36 | B37: 255 | C37: 390
A38: 37 | B38: 0 | C38: 360
A39: 38 | B39: 255 | C39: 390
A40: 39 | B40: 0 | C40: 274.26
A41: 40 | B41: 255 | C41: 303.959999999999
A42: 41 | B42: 0 | C42: 274.26
A43: 42 | B43: 255 | C43: 477.780000000001
A44: 43 | B44: 0 | C44: 190.200000000001
A45: 44 | B45: 255 | C45: 294.059999999999
A46: 45 | B46: 0 | C46: 370
A47: 46 | B47: 255 | C47: 390
A48: 47 | B48: 0 | C48: 360
A49: 48 | B49: 255 | C49: 390
A50: 49 | B50: 0 | C50: 274.26
A51: 0 | B51: of:=SUM([.C1]; -8300) -> 180 | C51: 8480
A52: 255 | B52: of:=SUM([.C2]; -8300) -> 260 | C52: 8560
A53: 0 | B53: of:=SUM([.C3]; -8300) -> 250 | C53: 8550
A54: 255 | B54: of:=SUM([.C4]; -8300) -> 310 | C54: 8610
A55: 0 | B55: of:=SUM([.C5]; -8300) -> 204.950000000001 | C55: 8504.95
A56: 255 | B56: of:=SUM([.C6]; -8300) -> 244.549999999999 | C56: 8544.55
A57: 0 | B57: of:=SUM([.C7]; -8300) -> 224.75 | C57: 8524.75
A58: 255 | B58: of:=SUM([.C8]; -8300) -> 447.469999999999 | C58: 8747.47
A59: 0 | B59: of:=SUM([.C9]; -8300) -> 150.98 | C59: 8450.98
A60: 255 | B60: of:=SUM([.C10]; -8300) -> 274.26 | C60: 8574.26
A61: 0 | B61: of:=SUM([.C11]; -8300) -> 340 | C61: 8640
A62: 255 | B62: of:=SUM([.C12]; -8300) -> 360 | C62: 8660
A63: 0 | B63: of:=SUM([.C13]; -8300) -> 350 | C63: 8650
A64: 255 | B64: of:=SUM([.C14]; -8300) -> 370 | C64: 8670
A65: 0 | B65: of:=SUM([.C15]; -8300) -> 254.459999999999 | C65: 8554.46
A66: 255 | B66: of:=SUM([.C16]; -8300) -> 370 | C66: 8670
A67: 0 | B67: of:=SUM([.C17]; -8300) -> 350 | C67: 8650
A68: 255 | B68: of:=SUM([.C18]; -8300) -> 380 | C68: 8680
A69: 0 | B69: of:=SUM([.C19]; -8300) -> 180.389999999999 | C69: 8480.39
A70: 255 | B70: of:=SUM([.C20]; -8300) -> 380 | C70: 8680
A71: 0 | B71: of:=SUM([.C21]; -8300) -> 274.26 | C71: 8574.26
A72: 255 | B72: of:=SUM([.C22]; -8300) -> 390 | C72: 8690
A73: 0 | B73: of:=SUM([.C23]; -8300) -> 350 | C73: 8650
A74: 255 | B74: of:=SUM([.C24]; -8300) -> 294.059999999999 | C74: 8594.06
A75: 0 | B75: of:=SUM([.C25]; -8300) -> 360 | C75: 8660
A76: 255 | B76: of:=SUM([.C26]; -8300) -> 390 | C76: 8690
A77: 0 | B77: of:=SUM([.C27]; -8300) -> 350 | C77: 8650
A78: 255 | B78: of:=SUM([.C28]; -8300) -> 380 | C78: 8680
A79: 0 | B79: of:=SUM([.C29]; -8300) -> 274.26 | C79: 8574.26
A80: 255 | B80: of:=SUM([.C30]; -8300) -> 303.959999999999 | C80: 8603.96
A81: 0 | B81: of:=SUM([.C31]; -8300) -> 264.360000000001 | C81: 8564.36
A82: 255 | B82: of:=SUM([.C32]; -8300) -> 477.780000000001 | C82: 8777.78
A83: 0 | B83: of:=SUM([.C33]; -8300) -> 274.26 | C83: 8574.26
A84: 255 | B84: of:=SUM([.C34]; -8300) -> 294.059999999999 | C84: 8594.06
A85: 0 | B85: of:=SUM([.C35]; -8300) -> 360 | C85: 8660
A86: 255 | B86: of:=SUM([.C36]; -8300) -> 390 | C86: 8690
A87: 0 | B87: of:=SUM([.C37]; -8300) -> 360 | C87: 8660
A88: 255 | B88: of:=SUM([.C38]; -8300) -> 390 | C88: 8690
A89: 0 | B89: of:=SUM([.C39]; -8300) -> 274.26 | C89: 8574.26
A90: 255 | B90: of:=SUM([.C40]; -8300) -> 303.959999999999 | C90: 8603.96
A91: 0 | B91: of:=SUM([.C41]; -8300) -> 274.26 | C91: 8574.26
A92: 255 | B92: of:=SUM([.C42]; -8300) -> 477.780000000001 | C92: 8777.78
A93: 0 | B93: of:=SUM([.C43]; -8300) -> 190.200000000001 | C93: 8490.2
A94: 255 | B94: of:=SUM([.C44]; -8300) -> 294.059999999999 | C94: 8594.06
A95: 0 | B95: of:=SUM([.C45]; -8300) -> 370 | C95: 8670
A96: 255 | B96: of:=SUM([.C46]; -8300) -> 390 | C96: 8690
A97: 0 | B97: of:=SUM([.C47]; -8300) -> 360 | C97: 8660
A98: 255 | B98: of:=SUM([.C48]; -8300) -> 390 | C98: 8690
A99: 0 | B99: of:=SUM([.C49]; -8300) -> 274.26 | C99: 8574.26

Sheet: 50ms
B1: Column A | C1: Column B
A2: 1 | B2: 0 | C2: 220
A3: 2 | B3: 255 | C3: 155.450000000001
A4: 3 | B4: 0 | C4: 150.98
A5: 4 | B5: 255 | C5: 224.75
A6: 5 | B6: 0 | C6: 380
A7: 6 | B7: 255 | C7: 274.26
A8: 7 | B8: 0 | C8: 249.02
A9: 8 | B9: 255 | C9: 294.059999999999
A10: 9 | B10: 0 | C10: 460
A11: 10 | B11: 255 | C11: 487.879999999999
A12: 11 | B12: 0 | C12: 288.24
A13: 12 | B13: 255 | C13: 410
A14: 13 | B14: 0 | C14: 480
A15: 14 | B15: 255 | C15: 508.08
A16: 15 | B16: 0 | C16: 307.84
A17: 16 | B17: 255 | C17: 420
A18: 17 | B18: 0 | C18: 500
A19: 18 | B19: 255 | C19: 518.18
A20: 19 | B20: 0 | C20: 327.450000000001
A21: 20 | B21: 255 | C21: 440
A22: 21 | B22: 0 | C22: 327.450000000001
A23: 22 | B23: 255 | C23: 518.18
A24: 23 | B24: 0 | C24: 500
A25: 24 | B25: 255 | C25: 430
A26: 25 | B26: 0 | C26: 180.77
A27: 26 | B27: 255 | C27: 440
A28: 27 | B28: 0 | C28: 347.059999999999
A29: 28 | B29: 255 | C29: 440
A30: 29 | B30: 0 | C30: 180.77
A31: 30 | B31: 255 | C31: 353.459999999999
A32: 31 | B32: 0 | C32: 500
A33: 32 | B33: 255 | C33: 353.459999999999
A34: 33 | B34: 0 | C34: 347.059999999999
A35: 34 | B35: 255 | C35: 363.370000000001
A36: 35 | B36: 0 | C36: 500
A37: 36 | B37: 255 | C37: 353.459999999999
A38: 37 | B38: 0 | C38: 347.059999999999
A39: 38 | B39: 255 | C39: 363.370000000001
A40: 39 | B40: 0 | C40: 500
A41: 40 | B41: 255 | C41: 450
A42: 41 | B42: 0 | C42: 327.450000000001
A43: 42 | B43: 255 | C43: 450
A44: 43 | B44: 0 | C44: 520
A45: 44 | B45: 255 | C45: 450
A46: 45 | B46: 0 | C46: 347.059999999999
A47: 46 | B47: 255 | C47: 450
A48: 47 | B48: 0 | C48: 500
A49: 48 | B49: 255 | C49: 450
A50: 49 | B50: 0 | C50: 347.059999999999
A51: 50 | B51: 255 | C51: 450
A52: 51 | B52: 0 | C52: 520
A53: 52 | B53: 255 | C53: 450
A54: 53 | B54: 0 | C54: 347.059999999999
A55: 54 | B55: 255 | C55: 450
A56: 55 | B56: 0 | C56: 347.059999999999
A57: 56 | B57: 255 | C57: 538.379999999999
A58: 57 | B58: 0 | C58: 200
A59: 58 | B59: 255 | C59: 460
A60: 59 | B60: 0 | C60: 347.059999999999
A61: 0 | B61: of:=SUM([.C1]; -8300) -> 220 | C61: 8520
A62: 255 | B62: of:=SUM([.C2]; -8300) -> 155.450000000001 | C62: 8455.45
A63: 0 | B63: of:=SUM([.C3]; -8300) -> 150.98 | C63: 8450.98
A64: 255 | B64: of:=SUM([.C4]; -8300) -> 224.75 | C64: 8524.75
A65: 0 | B65: of:=SUM([.C5]; -8300) -> 380 | C65: 8680
A66: 255 | B66: of:=SUM([.C6]; -8300) -> 274.26 | C66: 8574.26
A67: 0 | B67: of:=SUM([.C7]; -8300) -> 249.02 | C67: 8549.02
A68: 255 | B68: of:=SUM([.C8]; -8300) -> 294.059999999999 | C68: 8594.06
A69: 0 | B69: of:=SUM([.C9]; -8300) -> 460 | C69: 8760
A70: 255 | B70: of:=SUM([.C10]; -8300) -> 487.879999999999 | C70: 8787.88
A71: 0 | B71: of:=SUM([.C11]; -8300) -> 288.24 | C71: 8588.24
A72: 255 | B72: of:=SUM([.C12]; -8300) -> 410 | C72: 8710
A73: 0 | B73: of:=SUM([.C13]; -8300) -> 480 | C73: 8780
A74: 255 | B74: of:=SUM([.C14]; -8300) -> 508.08 | C74: 8808.08
A75: 0 | B75: of:=SUM([.C15]; -8300) -> 307.84 | C75: 8607.84
A76: 255 | B76: of:=SUM([.C16]; -8300) -> 420 | C76: 8720
A77: 0 | B77: of:=SUM([.C17]; -8300) -> 500 | C77: 8800
A78: 255 | B78: of:=SUM([.C18]; -8300) -> 518.18 | C78: 8818.18
A79: 0 | B79: of:=SUM([.C19]; -8300) -> 327.450000000001 | C79: 8627.45
A80: 255 | B80: of:=SUM([.C20]; -8300) -> 440 | C80: 8740
A81: 0 | B81: of:=SUM([.C21]; -8300) -> 327.450000000001 | C81: 8627.45
A82: 255 | B82: of:=SUM([.C22]; -8300) -> 518.18 | C82: 8818.18
A83: 0 | B83: of:=SUM([.C23]; -8300) -> 500 | C83: 8800
A84: 255 | B84: of:=SUM([.C24]; -8300) -> 430 | C84: 8730
A85: 0 | B85: of:=SUM([.C25]; -8300) -> 180.77 | C85: 8480.77
A86: 255 | B86: of:=SUM([.C26]; -8300) -> 440 | C86: 8740
A87: 0 | B87: of:=SUM([.C27]; -8300) -> 347.059999999999 | C87: 8647.06
A88: 255 | B88: of:=SUM([.C28]; -8300) -> 440 | C88: 8740
A89: 0 | B89: of:=SUM([.C29]; -8300) -> 180.77 | C89: 8480.77
A90: 255 | B90: of:=SUM([.C30]; -8300) -> 353.459999999999 | C90: 8653.46
A91: 0 | B91: of:=SUM([.C31]; -8300) -> 500 | C91: 8800
A92: 255 | B92: of:=SUM([.C32]; -8300) -> 353.459999999999 | C92: 8653.46
A93: 0 | B93: of:=SUM([.C33]; -8300) -> 347.059999999999 | C93: 8647.06
A94: 255 | B94: of:=SUM([.C34]; -8300) -> 363.370000000001 | C94: 8663.37
A95: 0 | B95: of:=SUM([.C35]; -8300) -> 500 | C95: 8800
A96: 255 | B96: of:=SUM([.C36]; -8300) -> 353.459999999999 | C96: 8653.46
A97: 0 | B97: of:=SUM([.C37]; -8300) -> 347.059999999999 | C97: 8647.06
A98: 255 | B98: of:=SUM([.C38]; -8300) -> 363.370000000001 | C98: 8663.37
A99: 0 | B99: of:=SUM([.C39]; -8300) -> 500 | C99: 8800
A100: 255 | B100: of:=SUM([.C40]; -8300) -> 450 | C100: 8750
A101: 0 | B101: of:=SUM([.C41]; -8300) -> 327.450000000001 | C101: 8627.45
A102: 255 | B102: of:=SUM([.C42]; -8300) -> 450 | C102: 8750
A103: 0 | B103: of:=SUM([.C43]; -8300) -> 520 | C103: 8820
A104: 255 | B104: of:=SUM([.C44]; -8300) -> 450 | C104: 8750
A105: 0 | B105: of:=SUM([.C45]; -8300) -> 347.059999999999 | C105: 8647.06
A106: 255 | B106: of:=SUM([.C46]; -8300) -> 450 | C106: 8750
A107: 0 | B107: of:=SUM([.C47]; -8300) -> 500 | C107: 8800
A108: 255 | B108: of:=SUM([.C48]; -8300) -> 450 | C108: 8750
A109: 0 | B109: of:=SUM([.C49]; -8300) -> 347.059999999999 | C109: 8647.06
A110: 255 | B110: of:=SUM([.C50]; -8300) -> 450 | C110: 8750
A111: 0 | B111: of:=SUM([.C51]; -8300) -> 520 | C111: 8820
A112: 255 | B112: of:=SUM([.C52]; -8300) -> 450 | C112: 8750
A113: 0 | B113: of:=SUM([.C53]; -8300) -> 347.059999999999 | C113: 8647.06
A114: 255 | B114: of:=SUM([.C54]; -8300) -> 450 | C114: 8750
A115: 0 | B115: of:=SUM([.C55]; -8300) -> 347.059999999999 | C115: 8647.06
A116: 255 | B116: of:=SUM([.C56]; -8300) -> 538.379999999999 | C116: 8838.38
A117: 0 | B117: of:=SUM([.C57]; -8300) -> 200 | C117: 8500
A118: 255 | B118: of:=SUM([.C58]; -8300) -> 460 | C118: 8760
A119: 0 | B119: of:=SUM([.C59]; -8300) -> 347.059999999999 | C119: 8647.06

Sheet: 10ms
B1: Column A | C1: Column B
A2: 1 | B2: 0 | C2: 400
A3: 2 | B3: 255 | C3: 10
A4: 3 | B4: 0 | C4: 700
A5: 4 | B5: 255 | C5: 180
A6: 5 | B6: 0 | C6: -800
A7: 6 | B7: 255 | C7: 195.049999999999
A8: 7 | B8: 0 | C8: 900
A9: 8 | B9: 255 | C9: 274.26
A10: 9 | B10: 0 | C10: 154.540000000001
A11: 10 | B11: 255 | C11: 410
A12: 11 | B12: 0 | C12: 1000
A13: 12 | B13: 255 | C13: 440
A14: 13 | B14: 0 | C14: 1000
A15: 14 | B15: 255 | C15: 470
A16: 15 | B16: 0 | C16: -550
A17: 16 | B17: 255 | C17: 393.07
A18: 17 | B18: 0 | C18: 1100
A19: 18 | B19: 255 | C19: 412.870000000001
A20: 19 | B20: 0 | C20: 245.450000000001
A21: 20 | B21: 255 | C21: 588.889999999999
A22: 21 | B22: 0 | C22: 1100
A23: 22 | B23: 255 | C23: 510
A24: 23 | B24: 0 | C24: 1100
A25: 24 | B25: 255 | C25: 510
A26: 25 | B26: 0 | C26: -466.67
A27: 26 | B27: 255 | C27: 432.67
A28: 27 | B28: 0 | C28: 1100
A29: 28 | B29: 255 | C29: 432.67
A30: 29 | B30: 0 | C30: 245.450000000001
A31: 30 | B31: 255 | C31: 609.09
A32: 31 | B32: 0 | C32: 1100
A33: 32 | B33: 255 | C33: 510
A34: 33 | B34: 0 | C34: 1200
A35: 34 | B35: 255 | C35: 609.09
A36: 35 | B36: 0 | C36: -383.33
A37: 36 | B37: 255 | C37: 432.67
A38: 37 | B38: 0 | C38: 1200
A39: 38 | B39: 255 | C39: 432.67
A40: 39 | B40: 0 | C40: 245.450000000001
A41: 40 | B41: 255 | C41: 530
A42: 41 | B42: 0 | C42: 1100
A43: 42 | B43: 255 | C43: 520
A44: 43 | B44: 0 | C44: 1200
A45: 44 | B45: 255 | C45: 609.09
A46: 45 | B46: 0 | C46: -383.33
A47: 46 | B47: 255 | C47: 432.67
A48: 47 | B48: 0 | C48: 1200
A49: 48 | B49: 255 | C49: 432.67
A50: 49 | B50: 0 | C50: 336.360000000001
A51: 50 | B51: 255 | C51: 520
A52: 51 | B52: 0 | C52: 1200
A53: 52 | B53: 255 | C53: 520
A54: 53 | B54: 0 | C54: 1100
A55: 54 | B55: 255 | C55: 609.09
A56: 55 | B56: 0 | C56: -383.33
A57: 56 | B57: 255 | C57: 520
A58: 57 | B58: 0 | C58: 336.360000000001
A59: 58 | B59: 255 | C59: 442.57
A60: 59 | B60: 0 | C60: 245.450000000001
A61: 0 | B61: of:=SUM([.C1]; -8300) -> 400 | C61: 8700
A62: 255 | B62: of:=SUM([.C2]; -8300) -> 10 | C62: 8310
A63: 0 | B63: of:=SUM([.C3]; -8300) -> 700 | C63: 9000
A64: 255 | B64: of:=SUM([.C4]; -8300) -> 180 | C64: 8480
A65: 0 | B65: of:=SUM([.C5]; -8300) -> -800 | C65: 7500
A66: 255 | B66: of:=SUM([.C6]; -8300) -> 195.049999999999 | C66: 8495.05
A67: 0 | B67: of:=SUM([.C7]; -8300) -> 900 | C67: 9200
A68: 255 | B68: of:=SUM([.C8]; -8300) -> 274.26 | C68: 8574.26
A69: 0 | B69: of:=SUM([.C9]; -8300) -> 154.540000000001 | C69: 8454.54
A70: 255 | B70: of:=SUM([.C10]; -8300) -> 410 | C70: 8710
A71: 0 | B71: of:=SUM([.C11]; -8300) -> 1000 | C71: 9300
A72: 255 | B72: of:=SUM([.C12]; -8300) -> 440 | C72: 8740
A73: 0 | B73: of:=SUM([.C13]; -8300) -> 1000 | C73: 9300
A74: 255 | B74: of:=SUM([.C14]; -8300) -> 470 | C74: 8770
A75: 0 | B75: of:=SUM([.C15]; -8300) -> -550 | C75: 7750
A76: 255 | B76: of:=SUM([.C16]; -8300) -> 393.07 | C76: 8693.07
A77: 0 | B77: of:=SUM([.C17]; -8300) -> 1100 | C77: 9400
A78: 255 | B78: of:=SUM([.C18]; -8300) -> 412.870000000001 | C78: 8712.87
A79: 0 | B79: of:=SUM([.C19]; -8300) -> 245.450000000001 | C79: 8545.45
A80: 255 | B80: of:=SUM([.C20]; -8300) -> 588.889999999999 | C80: 8888.89
A81: 0 | B81: of:=SUM([.C21]; -8300) -> 1100 | C81: 9400
A82: 255 | B82: of:=SUM([.C22]; -8300) -> 510 | C82: 8810
A83: 0 | B83: of:=SUM([.C23]; -8300) -> 1100 | C83: 9400
A84: 255 | B84: of:=SUM([.C24]; -8300) -> 510 | C84: 8810
A85: 0 | B85: of:=SUM([.C25]; -8300) -> -466.67 | C85: 7833.33
A86: 255 | B86: of:=SUM([.C26]; -8300) -> 432.67 | C86: 8732.67
A87: 0 | B87: of:=SUM([.C27]; -8300) -> 1100 | C87: 9400
A88: 255 | B88: of:=SUM([.C28]; -8300) -> 432.67 | C88: 8732.67
A89: 0 | B89: of:=SUM([.C29]; -8300) -> 245.450000000001 | C89: 8545.45
A90: 255 | B90: of:=SUM([.C30]; -8300) -> 609.09 | C90: 8909.09
A91: 0 | B91: of:=SUM([.C31]; -8300) -> 1100 | C91: 9400
A92: 255 | B92: of:=SUM([.C32]; -8300) -> 510 | C92: 8810
A93: 0 | B93: of:=SUM([.C33]; -8300) -> 1200 | C93: 9500
A94: 255 | B94: of:=SUM([.C34]; -8300) -> 609.09 | C94: 8909.09
A95: 0 | B95: of:=SUM([.C35]; -8300) -> -383.33 | C95: 7916.67
A96: 255 | B96: of:=SUM([.C36]; -8300) -> 432.67 | C96: 8732.67
A97: 0 | B97: of:=SUM([.C37]; -8300) -> 1200 | C97: 9500
A98: 255 | B98: of:=SUM([.C38]; -8300) -> 432.67 | C98: 8732.67
A99: 0 | B99: of:=SUM([.C39]; -8300) -> 245.450000000001 | C99: 8545.45
A100: 255 | B100: of:=SUM([.C40]; -8300) -> 530 | C100: 8830
A101: 0 | B101: of:=SUM([.C41]; -8300) -> 1100 | C101: 9400
A102: 255 | B102: of:=SUM([.C42]; -8300) -> 520 | C102: 8820
A103: 0 | B103: of:=SUM([.C43]; -8300) -> 1200 | C103: 9500
A104: 255 | B104: of:=SUM([.C44]; -8300) -> 609.09 | C104: 8909.09
A105: 0 | B105: of:=SUM([.C45]; -8300) -> -383.33 | C105: 7916.67
A106: 255 | B106: of:=SUM([.C46]; -8300) -> 432.67 | C106: 8732.67
A107: 0 | B107: of:=SUM([.C47]; -8300) -> 1200 | C107: 9500
A108: 255 | B108: of:=SUM([.C48]; -8300) -> 432.67 | C108: 8732.67
A109: 0 | B109: of:=SUM([.C49]; -8300) -> 336.360000000001 | C109: 8636.36
A110: 255 | B110: of:=SUM([.C50]; -8300) -> 520 | C110: 8820
A111: 0 | B111: of:=SUM([.C51]; -8300) -> 1200 | C111: 9500
A112: 255 | B112: of:=SUM([.C52]; -8300) -> 520 | C112: 8820
A113: 0 | B113: of:=SUM([.C53]; -8300) -> 1100 | C113: 9400
A114: 255 | B114: of:=SUM([.C54]; -8300) -> 609.09 | C114: 8909.09
A115: 0 | B115: of:=SUM([.C55]; -8300) -> -383.33 | C115: 7916.67
A116: 255 | B116: of:=SUM([.C56]; -8300) -> 520 | C116: 8820
A117: 0 | B117: of:=SUM([.C57]; -8300) -> 336.360000000001 | C117: 8636.36
A118: 255 | B118: of:=SUM([.C58]; -8300) -> 442.57 | C118: 8742.57
A119: 0 | B119: of:=SUM([.C59]; -8300) -> 245.450000000001 | C119: 8545.45
D120: 255 | E120: of:=SUM([.F60]; -8300) -> 520 | F120: 8820
D121: 0 | E121: of:=SUM([.F61]; -8300) -> 1200 | F121: 9500
D122: 255 | E122: of:=SUM([.F62]; -8300) -> 530 | F122: 8830
D123: 0 | E123: of:=SUM([.F63]; -8300) -> 1100 | F123: 9400
D124: 255 | E124: of:=SUM([.F64]; -8300) -> 619.190000000001 | F124: 8919.19
D125: 0 | E125: of:=SUM([.F65]; -8300) -> -383.33 | F125: 7916.67
D126: 255 | E126: of:=SUM([.F66]; -8300) -> 530 | F126: 8830
D127: 0 | E127: of:=SUM([.F67]; -8300) -> 245.450000000001 | F127: 8545.45
D128: 255 | E128: of:=SUM([.F68]; -8300) -> 442.57 | F128: 8742.57
D129: 0 | E129: of:=SUM([.F69]; -8300) -> 245.450000000001 | F129: 8545.45
D130: 255 | E130: of:=SUM([.F70]; -8300) -> 442.57 | F130: 8742.57
D131: 0 | E131: of:=SUM([.F71]; -8300) -> 1100 | F131: 9400
D132: 255 | E132: of:=SUM([.F72]; -8300) -> 530 | F132: 8830
D133: 0 | E133: of:=SUM([.F73]; -8300) -> 245.450000000001 | F133: 8545.45
D134: 255 | E134: of:=SUM([.F74]; -8300) -> 619.190000000001 | F134: 8919.19
D135: 0 | E135: of:=SUM([.F75]; -8300) -> 245.450000000001 | F135: 8545.45
D136: 255 | E136: of:=SUM([.F76]; -8300) -> 530 | F136: 8830
D137: 0 | E137: of:=SUM([.F77]; -8300) -> 245.450000000001 | F137: 8545.45
D138: 255 | E138: of:=SUM([.F78]; -8300) -> 442.57 | F138: 8742.57
D139: 0 | E139: of:=SUM([.F79]; -8300) -> 336.360000000001 | F139: 8636.36
D140: 255 | E140: of:=SUM([.F80]; -8300) -> 452.469999999999 | F140: 8752.47
D141: 0 | E141: of:=SUM([.F81]; -8300) -> 1100 | F141: 9400
D142: 255 | E142: of:=SUM([.F82]; -8300) -> 530 | F142: 8830
D143: 0 | E143: of:=SUM([.F83]; -8300) -> 336.360000000001 | F143: 8636.36
D144: 255 | E144: of:=SUM([.F84]; -8300) -> 619.190000000001 | F144: 8919.19
D145: 0 | E145: of:=SUM([.F85]; -8300) -> 1100 | F145: 9400
D146: 255 | E146: of:=SUM([.F86]; -8300) -> 530 | F146: 8830
D147: 0 | E147: of:=SUM([.F87]; -8300) -> 336.360000000001 | F147: 8636.36
D148: 255 | E148: of:=SUM([.F88]; -8300) -> 530 | F148: 8830
D149: 0 | E149: of:=SUM([.F89]; -8300) -> 336.360000000001 | F149: 8636.36
D150: 255 | E150: of:=SUM([.F90]; -8300) -> 452.469999999999 | F150: 8752.47
D151: 0 | E151: of:=SUM([.F91]; -8300) -> 1100 | F151: 9400
D152: 255 | E152: of:=SUM([.F92]; -8300) -> 530 | F152: 8830
D153: 0 | E153: of:=SUM([.F93]; -8300) -> 245.450000000001 | F153: 8545.45
D154: 255 | E154: of:=SUM([.F94]; -8300) -> 540 | F154: 8840
D155: 0 | E155: of:=SUM([.F95]; -8300) -> 1100 | F155: 9400
D156: 255 | E156: of:=SUM([.F96]; -8300) -> 530 | F156: 8830
D157: 0 | E157: of:=SUM([.F97]; -8300) -> -383.33 | F157: 7916.67
D158: 255 | E158: of:=SUM([.F98]; -8300) -> 540 | F158: 8840
D159: 0 | E159: of:=SUM([.F99]; -8300) -> 245.450000000001 | F159: 8545.45
D160: 255 | E160: of:=SUM([.F100]; -8300) -> 452.469999999999 | F160: 8752.47
D161: 0 | E161: of:=SUM([.F101]; -8300) -> 1100 | F161: 9400
D162: 255 | E162: of:=SUM([.F102]; -8300) -> 540 | F162: 8840
D163: 0 | E163: of:=SUM([.F103]; -8300) -> 245.450000000001 | F163: 8545.45
D164: 255 | E164: of:=SUM([.F104]; -8300) -> 540 | F164: 8840
D165: 0 | E165: of:=SUM([.F105]; -8300) -> 1100 | F165: 9400
D166: 255 | E166: of:=SUM([.F106]; -8300) -> 540 | F166: 8840
D167: 0 | E167: of:=SUM([.F107]; -8300) -> -466.67 | F167: 7833.33
D168: 255 | E168: of:=SUM([.F108]; -8300) -> 530 | F168: 8830
D169: 0 | E169: of:=SUM([.F109]; -8300) -> 1100 | F169: 9400
D170: 255 | E170: of:=SUM([.F110]; -8300) -> 442.57 | F170: 8742.57
D171: 0 | E171: of:=SUM([.F111]; -8300) -> 1200 | F171: 9500
D172: 255 | E172: of:=SUM([.F112]; -8300) -> 530 | F172: 8830
D173: 0 | E173: of:=SUM([.F113]; -8300) -> 336.360000000001 | F173: 8636.36
D174: 255 | E174: of:=SUM([.F114]; -8300) -> 530 | F174: 8830
D175: 0 | E175: of:=SUM([.F115]; -8300) -> 1200 | F175: 9500
D176: 255 | E176: of:=SUM([.F116]; -8300) -> 540 | F176: 8840
D177: 0 | E177: of:=SUM([.F117]; -8300) -> -466.67 | F177: 7833.33
D178: 255 | E178: of:=SUM([.F118]; -8300) -> 619.190000000001 | F178: 8919.19
D179: 0 | E179: of:=SUM([.F119]; -8300) -> 1200 | F179: 9500
D180: 255 | E180: of:=SUM([.F120]; -8300) -> 452.469999999999 | F180: 8752.47
D181: 0 | E181: of:=SUM([.F121]; -8300) -> 1100 | F181: 9400
D182: 255 | E182: of:=SUM([.F122]; -8300) -> 619.190000000001 | F182: 8919.19
D183: 0 | E183: of:=SUM([.F123]; -8300) -> 336.360000000001 | F183: 8636.36
D184: 255 | E184: of:=SUM([.F124]; -8300) -> 530 | F184: 8830
D185: 0 | E185: of:=SUM([.F125]; -8300) -> 1200 | F185: 9500
D186: 255 | E186: of:=SUM([.F126]; -8300) -> 540 | F186: 8840
D187: 0 | E187: of:=SUM([.F127]; -8300) -> -466.67 | F187: 7833.33
D188: 255 | E188: of:=SUM([.F128]; -8300) -> 530 | F188: 8830
D189: 0 | E189: of:=SUM([.F129]; -8300) -> 336.360000000001 | F189: 8636.36
D190: 255 | E190: of:=SUM([.F130]; -8300) -> 442.57 | F190: 8742.57
D191: 0 | E191: of:=SUM([.F131]; -8300) -> 1200 | F191: 9500
D192: 255 | E192: of:=SUM([.F132]; -8300) -> 629.290000000001 | F192: 8929.29
D193: 0 | E193: of:=SUM([.F133]; -8300) -> 245.450000000001 | F193: 8545.45
D194: 255 | E194: of:=SUM([.F134]; -8300) -> 530 | F194: 8830
D195: 0 | E195: of:=SUM([.F135]; -8300) -> 1200 | F195: 9500
D196: 255 | E196: of:=SUM([.F136]; -8300) -> 530 | F196: 8830
D197: 0 | E197: of:=SUM([.F137]; -8300) -> 336.360000000001 | F197: 8636.36
D198: 255 | E198: of:=SUM([.F138]; -8300) -> 540 | F198: 8840
D199: 0 | E199: of:=SUM([.F139]; -8300) -> 245.450000000001 | F199: 8545.45
D200: 255 | E200: of:=SUM([.F140]; -8300) -> 442.57 | F200: 8742.57
D201: 0 | E201: of:=SUM([.F141]; -8300) -> 1200 | F201: 9500
D202: 255 | E202: of:=SUM([.F142]; -8300) -> 540 | F202: 8840
D203: 0 | E203: of:=SUM([.F143]; -8300) -> 245.450000000001 | F203: 8545.45
D204: 255 | E204: of:=SUM([.F144]; -8300) -> 530 | F204: 8830
D205: 0 | E205: of:=SUM([.F145]; -8300) -> 1200 | F205: 9500
D206: 255 | E206: of:=SUM([.F146]; -8300) -> 540 | F206: 8840
D207: 0 | E207: of:=SUM([.F147]; -8300) -> 245.450000000001 | F207: 8545.45
D208: 255 | E208: of:=SUM([.F148]; -8300) -> 530 | F208: 8830
D209: 0 | E209: of:=SUM([.F149]; -8300) -> 336.360000000001 | F209: 8636.36
D210: 255 | E210: of:=SUM([.F150]; -8300) -> 452.469999999999 | F210: 8752.47
D211: 0 | E211: of:=SUM([.F151]; -8300) -> 1100 | F211: 9400
D212: 255 | E212: of:=SUM([.F152]; -8300) -> 540 | F212: 8840
D213: 0 | E213: of:=SUM([.F153]; -8300) -> 245.450000000001 | F213: 8545.45
D214: 255 | E214: of:=SUM([.F154]; -8300) -> 540 | F214: 8840
D215: 0 | E215: of:=SUM([.F155]; -8300) -> 1100 | F215: 9400
D216: 255 | E216: of:=SUM([.F156]; -8300) -> 530 | F216: 8830
D217: 0 | E217: of:=SUM([.F157]; -8300) -> 336.360000000001 | F217: 8636.36
D218: 255 | E218: of:=SUM([.F158]; -8300) -> 540 | F218: 8840
D219: 0 | E219: of:=SUM([.F159]; -8300) -> 336.360000000001 | F219: 8636.36
D220: 255 | E220: of:=SUM([.F160]; -8300) -> 452.469999999999 | F220: 8752.47
D221: 0 | E221: of:=SUM([.F161]; -8300) -> 1100 | F221: 9400

Sheet: README
A1: README: This data corresponds to the oscillate_pwm() test. The test characterizes the response of our Nidec 24H motors. Depending on the time_delay, we see how accurately our motors respond to the set PWM. We decided that 250ms is optimal for our purposes.